name,description,cost,ccal,weight,image,cuisine,type_slug,*ingredient_data
"Ризотто","Итальянское блюдо из риса, приготовленного в бульоне с добавлением сыра, белого вина и специй. Может включать грибы, морепродукты или овощи. Кремовая текстура и богатый вкус делают его кулинарным шедевром.",1395,386,537,./delivery_service/pictures database/0.png,italian_cuisine,main_course,рис арборио:300,куриный бульон:700,лук зеленый:1,чеснок:1,пармезан:50,вино белое полусладкое:100,сливочное масло:50,соль:1
"Паста Болоньезе","Спагетти с густым мясным соусом на основе томатов, говядины и специй. Готовится несколько часов, чтобы раскрыть вкус всех ингредиентов. Подаётся с пармезаном.",896,698,483,./delivery_service/pictures database/0.png,italian_cuisine,main_course,спагетти:300,телячий фарш:500,лук зеленый:1,чеснок:2,томатный соус:300,оливковое масло:30,морковь:1,сельдерей:1,пармезан:50,соль:1
"Брускетта","Хрустящие поджаренные кусочки хлеба, натёртые чесноком и политые оливковым маслом. Начинка может быть разной: от томатов с базиликом до пасты из оливок и анчоусов.",221,549,275,./delivery_service/pictures database/0.png,italian_cuisine,appetizer,батон:300,помидоры желтые:3,чеснок:2,оливковое масло:30,базилик тайский:1,соль:1
"Капрезе","Лёгкий салат из свежих томатов, моцареллы и базилика, заправленный оливковым маслом. Простой и освежающий, он идеально раскрывает вкус летних овощей и мягкого сыра.",974,568,445,./delivery_service/pictures database/0.png,italian_cuisine,appetizer,помидоры желтые:3,моцарелла:200,базилик тайский:1,оливковое масло:20,бальзамический уксус:10,соль:1
"Антипасти","Ассорти из итальянских закусок: сыров, мясных нарезок (прошутто, салями), маринованных овощей и оливок. Подаётся перед основными блюдами, чтобы разогреть аппетит.",295,586,397,./delivery_service/pictures database/0.png,italian_cuisine,appetizer,оливки:100,пармезан:50,прошутто:100,артишоки:50
"Фокачча","Мягкий итальянский хлеб с оливковым маслом и розмарином. Иногда дополняется оливками, сыром или вялеными томатами. Обладает приятной текстурой и ароматом.",953,394,468,./delivery_service/pictures database/0.png,italian_cuisine,appetizer,мука:500,дрожжи домашние:10,вода:250,оливковое масло:30,соль:1,розмарин:1
"Оливки","Классическая итальянская закуска, часто подаётся с хлебом и сыром. Могут быть зелёными или чёрными, маринованными в травах и специях.",1359,327,452,./delivery_service/pictures database/0.png,italian_cuisine,appetizer,оливки:200
"Тирамису","Знаменитый итальянский десерт из печенья савоярди, пропитанного кофе, и воздушного крема из маскарпоне. Посыпается какао и подаётся охлаждённым. Идеальное сочетание сладости, горечи и нежности.",1006,136,531,./delivery_service/pictures database/0.png,italian_cuisine,dessert,печенье Савоярди:200,яйца куриные:3,сахар:100,маскарпоне:250,кофе черный:100,какао-порошок обезжиренный:10
"Панна Котта","Нежный сливочный десерт с желатином, ванилью и ягодным соусом. Лёгкая текстура и насыщенный сливочный вкус делают его любимым лакомством.",995,688,274,./delivery_service/pictures database/0.png,italian_cuisine,dessert,сливки жирные:500,сахар:100,желатин:10,ванильный экстракт:1
"Канноли","Хрустящие трубочки из теста с кремом из рикотты, цедры цитрусовых и шоколада. Популярное сицилийское лакомство с насыщенным вкусом.",1435,284,417,./delivery_service/pictures database/0.png,italian_cuisine,dessert,мука:250,сахар:50,яйца куриные:1,вино белое полусладкое:50,сливочное масло:50,рикотта:200,шоколад:50
"Джелато","Итальянское мороженое, более насыщенное и мягкое, чем обычное. Бывает самых разных вкусов: от классического шоколада до экзотического фисташкового или лаванды.",755,375,552,./delivery_service/pictures database/0.png,italian_cuisine,dessert,молоко:500,сливки жирные:250,сахар:100,ванильный экстракт:1
"Сфольятелле","Слоёные пирожные с начинкой из рикотты, цукатов и ванили. Обладают хрустящей корочкой и нежной начинкой.",727,460,585,./delivery_service/pictures database/0.png,italian_cuisine,dessert,мука:400,сахар:100,яйца куриные:1,рикотта:200,лимонная цедра:1
"Эспрессо","Крепкий итальянский кофе с насыщенным ароматом. Готовится под высоким давлением, обладает густой пенкой и бодрящим эффектом.",234,209,466,./delivery_service/pictures database/0.png,italian_cuisine,drink,кофе черный:1
"Капучино","Эспрессо с пышной молочной пеной, создающей нежную текстуру и кремовый вкус. Подаётся в утренние часы, традиционно без сахара.",243,274,326,./delivery_service/pictures database/0.png,italian_cuisine,drink,кофе черный:1,молоко:100
"Лимончелло","Итальянский ликёр на основе лимонов, сахара и спирта. Обладает ярким цитрусовым вкусом и освежающим эффектом, подаётся охлаждённым.",573,727,452,./delivery_service/pictures database/0.png,italian_cuisine,drink,лимоны:250,спирт:500,сахар:200,вода:500
"Просекко","Игристое вино из региона венето. Лёгкое, фруктовое, с нотками яблок и персиков, прекрасно сочетается с закусками.",434,355,432,./delivery_service/pictures database/0.png,italian_cuisine,drink,вино белое столовое:1
"Вермут","Ароматизированное вино с травами и специями, используемое в коктейлях или как самостоятельный аперитив.",1039,381,348,./delivery_service/pictures database/0.png,italian_cuisine,drink,вино белое полусладкое:1,травы пряные с перцем:1
"Суши","Блюдо из риса, заправленного рисовым уксусом, и свежей рыбы, морепродуктов или овощей. Бывают разных видов: нигири (шарик риса с ломтиком рыбы), маки (роллы), сашими (тонкие ломтики рыбы без риса). Сочетаются с соевым соусом, васаби и маринованным имбирем.",794,495,322,./delivery_service/pictures database/0.png,japanese_cuisine,main_course,рис:200,рисовый уксус:1,нори:250,лосось:100,тунец филе:100,авокадо:1,огурцы:100,васаби:100,соевый соус:50
"Рамен","Сытный японский суп с пшеничной лапшой, мясным или рыбным бульоном, яйцом, зелёным луком, нори и кусочками свинины (чаcю). Различается по видам бульона: мисо, шою (соевый соус), шио (соль) и тонкоцу (свиной бульон).",778,564,538,./delivery_service/pictures database/0.png,japanese_cuisine,main_course,лапша:200,куриный бульон:700,соевый соус:50,чеснок:2,имбирь:1,яйца куриные:1,грибы шиитаке:50,лук зеленый:10
"Якитори","Шампуры с кусочками курицы, обжаренные на гриле. Готовятся с различными соусами, например, терияки, и могут включать овощи, грибы или рисовый пирог моти. Популярное уличное блюдо японии.",538,647,559,./delivery_service/pictures database/0.png,japanese_cuisine,main_course,куриное филе:300,соевый соус:50,саке:5,имбирь:1,чеснок:1
"Тонкацу","Японская вариация свиной котлеты в панировке панко. Обжаривается во фритюре до хрустящей корочки и подаётся с капустным салатом и сладковато-пряным соусом тонкацу.",240,315,219,./delivery_service/pictures database/0.png,japanese_cuisine,main_course,свинина:300,сухари панировочные:100,яйца куриные:1,мука:50,соевый соус:30
"Оякодон","Традиционное японское блюдо, состоящее из курицы, тушённой с яйцом и луком в соевом соусе, подаётся на рисе. Название переводится как «родитель и ребёнок», отсылая к сочетанию курицы и яйца.",285,372,342,./delivery_service/pictures database/0.png,japanese_cuisine,main_course,курица тушка:300,яйца куриные:2,рис:200,соевый соус:50,лук зеленый:10
"Эдамаме","Варёные в подсоленной воде или на пару незрелые соевые бобы. Лёгкая и полезная закуска, богатая белком и клетчаткой, популярна в барах и ресторанах.",886,169,578,./delivery_service/pictures database/0.png,japanese_cuisine,appetizer,бобы:300,соль:1
"Мисо суп","Лёгкий бульон на основе мисо-пасты и рыбного бульона даси. Часто включает тофу, морские водоросли вакаме, зелёный лук и грибы. Подавляется в качестве закуски к любому японскому обеду.",1095,730,508,./delivery_service/pictures database/0.png,japanese_cuisine,appetizer,мисо-паста:50,водоросли:20,тофу:100,лук зеленый:1
"Такояки","Шарики из теста с кусочками осьминога, обжаренные в специальных формах. Подаются с соусом, майонезом, зелёным луком и стружкой сушёного тунца, которая «танцует» от тепла.",293,139,501,./delivery_service/pictures database/0.png,japanese_cuisine,appetizer,мука:200,яйца куриные:1,вода:250,осьминог:100,лук зеленый:10,соус:50
"Гёдза","Японские пельмени с начинкой из свинины, капусты и чеснока. Жарятся до хрустящей корочки, а затем слегка пропариваются. Подаются с соевым соусом и уксусом.",233,641,495,./delivery_service/pictures database/0.png,japanese_cuisine,appetizer,мука:200,свинина:300,лук зеленый:10,чеснок:10,имбирь:10,соевый соус:30
"Салат из водорослей","Свежий и лёгкий салат из морских водорослей вакаме, заправленный кунжутным маслом, рисовым уксусом и соевым соусом. Обладает хрустящей текстурой и насыщенным морским вкусом.",950,697,377,./delivery_service/pictures database/0.png,japanese_cuisine,appetizer,водоросли:50,соевый соус:30,кунжут:10,рисовый уксус:1
"Моти","Рисовые пирожные с тягучей текстурой, приготовленные из клейкого риса. Начиняются сладкой фасолевой пастой анко, фруктами или мороженым.",171,643,377,./delivery_service/pictures database/0.png,japanese_cuisine,dessert,рисовая мука:200,сахар:100,вода:200
"Дайфуку","Разновидность моти, наполненная сладким кремом или анко. Часто содержит цельную клубнику внутри, создавая яркий баланс сладости и кислинки.",351,779,328,./delivery_service/pictures database/0.png,japanese_cuisine,dessert,рисовая мука:200,фасоль красная:100
"Дораяки","Два мягких панкейка, склеенные сладкой пастой анко из красных бобов. Популярное уличное лакомство и любимый десерт многих японцев.",989,194,410,./delivery_service/pictures database/0.png,japanese_cuisine,dessert,мука:200,яйца куриные:2,сахар:100,мед:50,фасоль красная:100
"Тайяки","Печенье в форме рыбы, начинённое сладкой фасолевой пастой, кремом или шоколадом. Подаётся тёплым, с хрустящей корочкой и мягкой начинкой.",765,279,429,./delivery_service/pictures database/0.png,japanese_cuisine,dessert,мука:250,яйца куриные:2,сахар:100,фасоль красная:100
"Матча-кейк","Десерт с добавлением японского зелёного чая матча, придающего ему насыщенный вкус и нежную текстуру. Может быть в форме бисквита, чизкейка или мусса.",1044,674,327,./delivery_service/pictures database/0.png,japanese_cuisine,dessert,мука:200,сахар:100,яйца куриные:2,чай эрл грей:10
"Саке","Традиционный японский алкогольный напиток из риса, который может подаваться горячим или холодным. Имеет мягкий, слегка сладковатый вкус и разнообразные оттенки в зависимости от сорта.",156,788,211,./delivery_service/pictures database/0.png,japanese_cuisine,drink,рис:1,вода:1,дрожжи домашние:1
"Зелёный чай","Ароматный напиток с насыщенным травянистым вкусом и лёгкой горчинкой. Японцы пьют его ежедневно, ценя за антиоксиданты и бодрящий эффект.",1491,404,486,./delivery_service/pictures database/0.png,japanese_cuisine,drink,чай эрл грей:1,вода:1
"Кофе с молоком","В Японии часто подаётся с молоком или сливками, иногда с добавлением сиропов. Популярен среди работающих людей и студентов.",691,266,551,./delivery_service/pictures database/0.png,japanese_cuisine,drink,кофе черный:1,молоко:100
"Коктейль умэшу","Напиток на основе японского сливового ликёра умэшу, смешанный с содовой, льдом или чаем. Имеет сладкий фруктовый вкус и приятную кислинку.",1197,272,333,./delivery_service/pictures database/0.png,japanese_cuisine,drink,сливовое вино:100,вода минеральная газированная:100,лед:1
"Газировка рамунэ","Японская газировка в стеклянной бутылке с запечатанным шариком. Открывается надавливанием, создавая хлопок. Имеет освежающий вкус, вариации от лимонада до дыни и винограда. Популярен в летнюю жару и аниме-культуре.",1428,132,308,./delivery_service/pictures database/0.png,japanese_cuisine,drink,вода:1,сироп:100
